{"schema_version":"1.0","generated_at":"2026-07-06T19:05:00-03:00","setup_id":"1a4cb04a8753","docs_root":"docs","mode":"full","budget_bytes":80000,"total_ingestible_bytes":899,"files":[{"path":"apostila-derivadas.md","provenance":"student_provided","bytes":899,"sha256":"0b600dd4a1947b1adabc2b23852a5f1c6b1c6275940a2cc1875f9d63562da304","mtime":"2026-07-06T18:40:00-03:00","kind":"markdown","readable":true,"pages":null,"extracted_text_bytes":899,"extract_cache":null,"sections":[{"section_id":"anotacoes_da_apostila_capitulo_3_derivadas","heading":"Anotações da apostila — capítulo 3: derivadas","level":1,"offset":0,"bytes":54,"page_from":null,"page_to":null,"disputed":null},{"section_id":"3_1_taxa_de_variacao_media","heading":"3.1 Taxa de variação média","level":2,"offset":54,"bytes":225,"page_from":null,"page_to":null,"disputed":null},{"section_id":"3_2_derivada","heading":"3.2 Derivada","level":2,"offset":279,"bytes":286,"page_from":null,"page_to":null,"disputed":null},{"section_id":"3_3_regra_da_potencia","heading":"3.3 Regra da potência","level":2,"offset":565,"bytes":78,"page_from":null,"page_to":null,"disputed":null},{"section_id":"3_4_regra_da_cadeia","heading":"3.4 Regra da cadeia","level":2,"offset":643,"bytes":61,"page_from":null,"page_to":null,"disputed":null},{"section_id":"3_5_exercicios_do_capitulo","heading":"3.5 Exercícios do capítulo","level":2,"offset":704,"bytes":195,"page_from":null,"page_to":null,"disputed":null}]}],"loaded":[{"file":"apostila-derivadas.md","heading":null,"section_id":null,"bytes":899,"reason":"full_mode","score":null}],"left_out":[],"not_ingested":[]}
